{
  "$schema": "https://json-schema.org/draft/2020-12/schema",
  "type": "object",
  "required": [
    "version",
    "memory_profile_fields",
    "snapshot_rules",
    "pattern_thresholds"
  ],
  "properties": {
    "version": {
      "type": "string"
    },
    "memory_profile_fields": {
      "type": "array",
      "items": {
        "type": "string"
      }
    },
    "snapshot_rules": {
      "type": "object"
    },
    "pattern_thresholds": {
      "type": "object"
    }
  }
}